{
  "task_id": "two-repo-split",
  "authority": ["human:two-repo-split", "HD-15"],
  "allowed_paths": [
    "*",
    ".*",
    "**",
    "config/**",
    "docs/**",
    "examples/**",
    "scripts/**",
    "schemas/**",
    "tests/**",
    "tasks/**",
    "templates/**",
    "prompts/**",
    "data/**",
    "experiments/**",
    "lab/**",
    "artifacts/**"
  ],
  "forbidden_paths": [],
  "frozen_paths": [
    "prompts/evaluation/P1-A-v1.1.md",
    "prompts/evaluation/P1-B-v1.1.md",
    "prompts/evaluation/P1-PHOTOGRAPHIC-CRITICAL-FRAMEWORK-v1.0.md",
    "prompts/evaluation/P1-OUTPUT-CONTRACT-v1.0.md",
    "prompts/evaluation/P1-CROSS-MODEL-INVARIANTS-v1.0.md"
  ],
  "allowed_dependency_changes": true,
  "forbidden_operations": ["external_api_call", "photograph_transmission"],
  "require_verifier_evidence": false,
  "external_io_allowed": false,
  "commit_allowed": true
}
